{"id":"WTR-EGY-001","type":"water","title":"Egyptian Irrigation Systems","status":"active","version":"1.0.0","description":"Water-management practices associated with Nile agriculture, including basin irrigation and related control and distribution practices documented for ancient Egypt.","system_type":"irrigation","functions":["water distribution","agricultural cultivation","management of seasonal flooding"],"geographic_scope":"Nile Valley and Delta","date_range":"ancient Egypt; practices changed over time","technology_ids":[],"civilization_ids":["CIV-EGY-001"],"region_ids":["REG-NIL-001"],"source_ids":[],"evidence_ids":[],"notes":"Hydraulic technology evidence is contextual evidence only; it does not by itself establish the meaning of Genesis 1."}